{
  "report_version": "0.1",
  "generated_at": "2026-08-24T16:45:00Z",
  "subject": {
    "kind": "repository",
    "path": "/workspace/example-app",
    "revision": "git:abc123"
  },
  "inspector": {
    "name": "auditspec-reference-inspector",
    "version": "0.1.0",
    "adapters": ["rails-ast-assisted-v0.1", "assurance-call-graph-v0.1"]
  },
  "frameworks": [
    {
      "name": "rails",
      "confidence": "high",
      "evidence": ["Gemfile declares the rails gem"]
    }
  ],
  "boundaries": [
    {
      "id": "boundary_example_001",
      "fingerprint": "bfp_refund_update_001",
      "kind": "mutation",
      "framework": "rails",
      "operation": "update!",
      "location": {
        "path": "app/services/refund_service.rb",
        "line": 12,
        "column": 5
      },
      "audit_status": "uncovered",
      "confidence": "high",
      "reachability": {
        "status": "unknown",
        "confidence": "low",
        "path": ["RefundService#call"]
      },
      "evidence": [
        {
          "kind": "ast_call",
          "detail": "Tree-sitter AST detected Rails mutation call .update!",
          "location": {
            "path": "app/services/refund_service.rb",
            "line": 12,
            "column": 5
          }
        },
        {
          "kind": "assurance_path",
          "detail": "Resolved assurance path: RefundService#call [roles: mutation; confidence: high]",
          "location": {
            "path": "app/services/refund_service.rb",
            "line": 12,
            "column": 5
          }
        }
      ]
    }
  ],
  "findings": [
    {
      "id": "finding_example_001",
      "fingerprint": "fp_example_001",
      "rule_id": "AS-AUDIT-001",
      "title": "Unaudited mutation boundary",
      "severity": "warning",
      "confidence": "medium",
      "status": "open",
      "message": "Detected Rails mutation without a visible AuditSpec emission call in the owning method/function scope.",
      "location": {
        "path": "app/services/refund_service.rb",
        "line": 12,
        "column": 5
      },
      "boundary_id": "boundary_example_001",
      "evidence": [
        {
          "kind": "ast_analysis",
          "detail": "AST confirms .update! call; no AuditSpec.emit!/record! call found in the same scope in app/services/refund_service.rb",
          "location": {
            "path": "app/services/refund_service.rb",
            "line": 12,
            "column": 5
          }
        }
      ],
      "remediation": {
        "summary": "Emit a semantic AuditSpec event at the service/domain boundary that owns the mutation."
      }
    }
  ],
  "coverage": {
    "detected_boundaries": 1,
    "covered_boundaries": 0,
    "partial_boundaries": 0,
    "uncovered_boundaries": 1,
    "unknown_boundaries": 0,
    "audit_coverage": 0
  },
  "reachability": {
    "reachable_boundaries": 0,
    "unknown_boundaries": 1
  },
  "metadata": {
    "assessment_kind": "static_source_ast_assisted_with_assurance_graph",
    "non_blocking_recommended": true,
    "ast_parse_failures": 0
  }
}
